{
  "schema": "https://prompt-atoms.com/schemas/atom-v1.json",
  "type": "constraint",
  "id": "preserve-source-hedges",
  "version": "1.0.0",
  "name": "Preserve Source Hedges",
  "description": "Hedges in the source survive into the draft. Do not strengthen 'some scholars argue' into 'scholars agree' or 'the data suggest' into 'the data prove'.",
  "tags": ["research", "honesty", "provenance"],
  "vendors": ["any"],
  "content": "When summarizing a source, preserve its hedges exactly. 'Some scholars argue' must not become 'scholars agree'. 'The data suggest' must not become 'the data prove'. 'Preliminary evidence' must not become 'evidence'. If you are uncertain about a hedge's exact wording, paraphrase and label the paraphrase. Do not silently upgrade confidence.",
  "applicable_turns": ["system"]
}
